{
  "$schema": "https://json-schema.org/draft/2020-12/schema",
  "type": "object",
  "properties": {
    "$schema": {
      "type": "string"
    },
    "version": {
      "type": "number",
      "const": 1
    },
    "title": {
      "type": "object",
      "properties": {
        "en": {
          "type": "string",
          "minLength": 1
        },
        "de": {
          "type": "string",
          "minLength": 1
        }
      },
      "required": [
        "en",
        "de"
      ],
      "additionalProperties": false
    },
    "description": {
      "type": "object",
      "properties": {
        "en": {
          "type": "string",
          "minLength": 1
        },
        "de": {
          "type": "string",
          "minLength": 1
        }
      },
      "required": [
        "en",
        "de"
      ],
      "additionalProperties": false
    },
    "position": {
      "type": "integer",
      "minimum": 1,
      "maximum": 99999
    },
    "skills": {
      "minItems": 1,
      "maxItems": 4,
      "type": "array",
      "items": {
        "type": "object",
        "properties": {
          "en": {
            "type": "string",
            "minLength": 1
          },
          "de": {
            "type": "string",
            "minLength": 1
          }
        },
        "required": [
          "en",
          "de"
        ],
        "additionalProperties": false
      }
    },
    "selectSkill": {
      "default": true,
      "type": "boolean"
    },
    "skin": {
      "type": "string",
      "enum": [
        "flat",
        "neon"
      ]
    },
    "sounds": {
      "type": "string",
      "enum": [
        "lab",
        "school",
        "classic",
        "space",
        "sea",
        "crypt",
        "clinic"
      ]
    },
    "selectScreen": {
      "type": "string",
      "enum": [
        "lab",
        "school",
        "classic",
        "space",
        "sea",
        "crypt",
        "clinic"
      ]
    },
    "showsSolutions": {
      "type": "boolean"
    },
    "levelsFrom": {
      "type": "string",
      "pattern": "^[a-z0-9-]+$"
    },
    "rules": {
      "type": "object",
      "properties": {
        "coinAngles": {
          "type": "string",
          "enum": [
            "single",
            "sameColor"
          ]
        },
        "beamIntoLaser": {
          "type": "string",
          "enum": [
            "absorb",
            "pass"
          ]
        },
        "polarizer": {
          "type": "string",
          "enum": [
            "direction",
            "axis"
          ]
        },
        "actorsBlockLight": {
          "type": "boolean"
        }
      },
      "additionalProperties": false
    }
  },
  "required": [
    "version",
    "title",
    "position",
    "skills"
  ],
  "additionalProperties": false
}
